 
mysql> select * from Employee natural join Dept;
+---------+--------+----------+-------+-------------+--------+------------+-------+-----------+
| Dept_id | Emp_id | fname    | lname | designation | salary | joindate   | dname | dlocation |
+---------+--------+----------+-------+-------------+--------+------------+-------+-----------+
|       1 |      1 | Kshitija | XYX   | HR          |  50000 | 2015-01-01 | Comp  | Loc1      |
|       3 |      2 | Hema     | ABC   | Developer   |  20000 | 2014-01-01 | Entc  | Loc3      |
|       1 |      3 | Girija   | PQR   | Intern      |  10000 | 2019-01-01 | Comp  | Loc1      |
|       2 |      4 | Piyusha  | MNP   | Manager     |  35000 | 2010-01-01 | It    | Loc2      |
|       3 |      5 | Amar     | NMG   | Tester      |  35000 | 2011-01-01 | Entc  | Loc3      |
|       2 |      6 | Ram      | AHK   | Developer   |  25000 | 2020-01-01 | It    | Loc2      |
|       1 |      7 | Harry    | AGK   | Intern      |  45000 | 2021-01-01 | Comp  | Loc1      |
|       3 |      8 | Purva    | UHK   | Intern      |  45000 | 2016-01-01 | Entc  | Loc3      |
|       2 |      9 | Nikita   | LJK   | Intern      |  15000 | 2006-01-01 | It    | Loc2      |
|       1 |     10 | Sam      | MNH   | Developer   |  35000 | 2003-01-01 | Comp  | Loc1      |
+---------+--------+----------+-------+-------------+--------+------------+-------+-----------+
10 rows in set (0.00 sec)

mysql> select fname, designation, dlocation, joindate from Employee inner join Dept on Employee.Dept_id=Dept.Dept_id;
+----------+-------------+-----------+------------+
| fname    | designation | dlocation | joindate   |
+----------+-------------+-----------+------------+
| Kshitija | HR          | Loc1      | 2015-01-01 |
| Hema     | Developer   | Loc3      | 2014-01-01 |
| Girija   | Intern      | Loc1      | 2019-01-01 |
| Piyusha  | Manager     | Loc2      | 2010-01-01 |
| Amar     | Tester      | Loc3      | 2011-01-01 |
| Ram      | Developer   | Loc2      | 2020-01-01 |
| Harry    | Intern      | Loc1      | 2021-01-01 |
| Purva    | Intern      | Loc3      | 2016-01-01 |
| Nikita   | Intern      | Loc2      | 2006-01-01 |
| Sam      | Developer   | Loc1      | 2003-01-01 |
+----------+-------------+-----------+------------+
10 rows in set (0.00 sec)





 select * from Project;
+---------+---------+-----------+--------+
| Proj_id | Dept_id | Plocation | Pcost  |
+---------+---------+-----------+--------+
|       1 |       1 | Pune      | 110000 |
|       2 |       2 | Mumbai    | 560000 |
|       3 |       1 | Chennai   | 240000 |
+---------+---------+-----------+--------+
3 rows in set (0.00 sec)

mysql> alter table Project add Pyear date;
Query OK, 3 rows affected (0.08 sec)
Records: 3  Duplicates: 0  Warnings: 0

mysql> update Project set Pyear='2015-01-01' where Proj_id='1';
Query OK, 1 row affected (0.02 sec)
Rows matched: 1  Changed: 1  Warnings: 0

mysql> update Project set Pyear='2010-01-01' where Proj_id='2';
Query OK, 1 row affected (0.01 sec)
Rows matched: 1  Changed: 1  Warnings: 0

mysql> update Project set Pyear='2011-01-01' where Proj_id='3';
Query OK, 1 row affected (0.02 sec)
Rows matched: 1  Changed: 1  Warnings: 0

mysql> select * from Project where Pyear='2015-01-01';
+---------+---------+-----------+--------+------------+
| Proj_id | Dept_id | Plocation | Pcost  | Pyear      |
+---------+---------+-----------+--------+------------+
|       1 |       1 | Pune      | 110000 | 2015-01-01 |
+---------+---------+-----------+--------+------------+
1 row in set (0.00 sec)



mysql> select dname from Dept natural join Employee ;
+-------+
| dname |
+-------+
| Comp  |
| Comp  |
| Comp  |
| Comp  |
| It    |
| It    |
| It    |
| Entc  |
| Entc  |
| Entc  |
+-------+
10 rows in set (0.00 sec)

mysql> select dname from Dept natural join Employee where date(Employee.joindate) <= now();
+-------+
| dname |
+-------+
| Comp  |
| Entc  |
| Comp  |
| It    |
| Entc  |
| It    |
| Comp  |
| Entc  |
| It    |
| Comp  |
+-------+
10 rows in set (0.00 sec)

mysql> select dname from Dept natural join Employee where date(Employee.joindate) <='2015-01-01';
+-------+
| dname |
+-------+
| Comp  |
| Entc  |
| It    |
| Entc  |
| It    |
| Comp  |
+-------+
6 rows in set (0.00 sec)

mysql> select * from Dept natural join Employee where date(Employee.joindate) <='2015-01-01';
+---------+-------+-----------+--------+----------+-------+-------------+--------+------------+
| Dept_id | dname | dlocation | Emp_id | fname    | lname | designation | salary | joindate   |
+---------+-------+-----------+--------+----------+-------+-------------+--------+------------+
|       1 | Comp  | Loc1      |      1 | Kshitija | XYX   | HR          |  50000 | 2015-01-01 |
|       3 | Entc  | Loc3      |      2 | Hema     | ABC   | Developer   |  20000 | 2014-01-01 |
|       2 | It    | Loc2      |      4 | Piyusha  | MNP   | Manager     |  35000 | 2010-01-01 |
|       3 | Entc  | Loc3      |      5 | Amar     | NMG   | Tester      |  35000 | 2011-01-01 |
|       2 | It    | Loc2      |      9 | Nikita   | LJK   | Intern      |  15000 | 2006-01-01 |
|       1 | Comp  | Loc1      |     10 | Sam      | MNH   | Developer   |  35000 | 2003-01-01 |
+---------+-------+-----------+--------+----------+-------+-------------+--------+------------+
6 rows in set (0.01 sec)

mysql> 




